{
  "event_id": "evt-00000029-5ef0681b-1cd1-4576-830b-e2a5642e00b3",
  "idempotency_key": "qa-assign:467:3",
  "sequence": 29,
  "previous_snapshot_hash": "f33443ad6587d3f75bb1613d0841edb5ddc5ab85633c8d15238679bc93e17e23",
  "issue_id": "467",
  "actor": "seat:qa-functional:457bc1cc-2908-4137-8d3f-fba0bbe321f7",
  "machine_id": "97d0e34e-194a-4bca-ace1-ad66903e39c4",
  "lease_id": "qa-lease:467:3",
  "lease_epoch": 3,
  "event_type": "QA_ASSIGNED",
  "exact_object": {
    "oid": "4a14a6025064a03c9eeae37495d16496dcf43560"
  },
  "payload": {
    "candidate_commit": "4a14a6025064a03c9eeae37495d16496dcf43560",
    "lease_expiry": "2026-08-31T15:40:59.231Z"
  },
  "created_at": "2026-08-31T15:10:59.231Z"
}
