{
  "event_id": "evt-00000010-2d856748-c8c9-4e69-98ca-ce78be1dae8c",
  "idempotency_key": "CANDIDATE_READY:470:1:83f628925c211abe1afa8bd44cba946b04369fdb",
  "sequence": 10,
  "previous_snapshot_hash": "eb57b9c521072066fe4d8afab242f0a57a9611421dba1cd104a5b16db6cf4f10",
  "issue_id": "470",
  "actor": "seat:worker-c:913ae4a5-15d7-40ea-a622-55324f0fe48e",
  "machine_id": "28f5306c-f01b-4830-b5f8-7856e4dc8482",
  "lease_id": "lease:470:1",
  "lease_epoch": 1,
  "event_type": "CANDIDATE_READY",
  "exact_object": {
    "oid": "83f628925c211abe1afa8bd44cba946b04369fdb"
  },
  "payload": {
    "candidate_commit": "83f628925c211abe1afa8bd44cba946b04369fdb",
    "evidence_pointers": [
      "VERIFY OK at head",
      "render idempotent",
      "3-file footprint"
    ]
  },
  "created_at": "2026-08-31T14:00:16.385Z"
}
